{
  "schemaVersion": 2,
  "mode": "fresh",
  "network": "preprod",
  "provider": "blockfrost",
  "tld": "cardano",
  "confirmed": {
    "fund": {
      "txId": "afafd7b6a1fd11b3c07babafe658f05186348ee70ca975dabe2292e8ceb94b22",
      "manifest": "E:\\Computer Eng\\Projects\\Handshake\\dns-cli\\demo\\runs\\cardano\\artifacts\\00-fund.manifest.json"
    },
    "deploy": {
      "txId": "67029464e58b022d4c878ba69ccb8869d3da89c7d8b4af31b224b82cc65ef9eb",
      "manifest": "E:\\Computer Eng\\Projects\\Handshake\\dns-cli\\demo\\runs\\cardano\\artifacts\\01-deploy.manifest.json"
    },
    "register": {
      "txId": "24cfaa7065054c112663f19d05d6f2d5da9b9afbda1eeebc7f7d2c8f9b9470e1",
      "manifest": "E:\\Computer Eng\\Projects\\Handshake\\dns-cli\\demo\\runs\\cardano\\artifacts\\02-register.manifest.json"
    },
    "activate": {
      "txId": "414bc887c39355381138b0c5c4cd835ebd1def52697aa6ac05fa0b6afd914237",
      "manifest": "E:\\Computer Eng\\Projects\\Handshake\\dns-cli\\demo\\runs\\cardano\\artifacts\\03-activate.manifest.json"
    }
  }
}
