{
  "schemaVersion": 2,
  "mode": "fresh",
  "network": "preprod",
  "provider": "blockfrost",
  "tld": "andamio",
  "confirmed": {
    "fund": {
      "txId": "d2c5d2858aa1d14cc6f526e6ad53c79c7510767b1751999760d6ea4a04a4578b",
      "manifest": "E:\\Computer Eng\\Projects\\Handshake\\dns-cli\\demo\\runs\\andamio\\artifacts\\00-fund.manifest.json"
    },
    "deploy": {
      "txId": "3076679d799c61553bf1062abae3cb54212ad415a1c40d365a14db4b89fcd701",
      "manifest": "E:\\Computer Eng\\Projects\\Handshake\\dns-cli\\demo\\runs\\andamio\\artifacts\\01-deploy.manifest.json"
    },
    "register": {
      "txId": "1d414d50bddfca53922cb00343b7eed9a2c2133a0aef0336c3e7c890abf796cf",
      "manifest": "E:\\Computer Eng\\Projects\\Handshake\\dns-cli\\demo\\runs\\andamio\\artifacts\\02-register.manifest.json"
    },
    "activate": {
      "txId": "52ca625a098d506a649c099a0f088d708f37104bc69265ac6a7cda6a5fd7e4d0",
      "manifest": "E:\\Computer Eng\\Projects\\Handshake\\dns-cli\\demo\\runs\\andamio\\artifacts\\03-activate.manifest.json"
    }
  }
}
