{
  "schemaVersion": 2,
  "mode": "fresh",
  "network": "preprod",
  "provider": "blockfrost",
  "tld": "ada",
  "confirmed": {
    "fund": {
      "txId": "ebd8c028492b56d9d78cd09ed55217e6500a283580a6bbfd7f911b162b52710b",
      "manifest": "E:\\Computer Eng\\Projects\\Handshake\\dns-cli\\demo\\runs\\ada\\artifacts\\00-fund.manifest.json"
    },
    "deploy": {
      "txId": "8fd16b7b7a88a94e76c09b4ddb3e4398a13d89301ff01394af5cc56febe33331",
      "manifest": "E:\\Computer Eng\\Projects\\Handshake\\dns-cli\\demo\\runs\\ada\\artifacts\\01-deploy.manifest.json"
    },
    "register": {
      "txId": "6fa17a3b777c509466657981050697c00669aedc9c756f45a61c72527cbcf9e7",
      "manifest": "E:\\Computer Eng\\Projects\\Handshake\\dns-cli\\demo\\runs\\ada\\artifacts\\02-register.manifest.json"
    },
    "activate": {
      "txId": "5422558dc58d6cfeb03afd7cfa99576dbfe535ce575c4e3b43da622c194742f0",
      "manifest": "E:\\Computer Eng\\Projects\\Handshake\\dns-cli\\demo\\runs\\ada\\artifacts\\03-activate.manifest.json"
    }
  }
}
